<?xml version="1.0"?><ShapeChangeConfiguration xmlns:xi="http://www.w3.org/2001/XInclude" xmlns:xsi="http://www.w3.org/2001/XMLSchema-instance" xmlns:sc="http://www.interactive-instruments.de/ShapeChange/Configuration/1.1" xsi:schemaLocation="http://www.interactive-instruments.de/ShapeChange/Configuration/1.1 http://shapechange.net/resources/schema/ShapeChangeConfiguration.xsd" xmlns="http://www.interactive-instruments.de/ShapeChange/Configuration/1.1"><input><parameter name="inputModelType" value="EA7" /><parameter name="inputFile" value="C:\Data\isotc211\Redlands\UMLdocumentation\WorkshopRedlands\ShapeChange\ISO19135-1_Full19135_extension.eap" /><parameter name="appSchemaName" value="«applicationSchema» ISO 19135-1 Procedures for Registration - Extended schema" /><parameter name="addTaggedValues" value="SOSI_navn,NVDB_ID" /><parameter name="representTaggedValues" value="alwaysVoid,neverVoid,Code,lastChange,appliesTo,SOSI_navn,NVDB_ID" /><xi:include href="http://shapechange.net/resources/config/StandardAliases.xml" /></input><log><parameter name="reportLevel" value="INFO" /><parameter name="logFile" value="C:\Data\isotc211\Redlands\UMLdocumentation\WorkshopRedlands\ShapeChange\log.xml" /></log><targets><TargetXmlSchema class="de.interactive_instruments.ShapeChange.Target.XmlSchema.XmlSchema" mode="enabled"><targetParameter name="outputDirectory" value="C:\Data\isotc211\Redlands\UMLdocumentation\WorkshopRedlands\ShapeChange\XSD" /><targetParameter name="defaultEncodingRule" value="sosi" /><xi:include href="http://www.arkitektum.no/files/sosi/StandardRules.xml" /><xi:include href="http://shapechange.net/resources/config/StandardNamespaces.xml" /><xi:include href="C:\Data\isotc211\Redlands\UMLdocumentation\WorkshopRedlands\ShapeChange/config/StandardMapEntries.xml" /></TargetXmlSchema><Target class="de.interactive_instruments.ShapeChange.Target.FeatureCatalogue.FeatureCatalogue" mode="enabled"><targetParameter name="outputDirectory" value="C:\Data\isotc211\Redlands\UMLdocumentation\WorkshopRedlands\ShapeChange\FC" /><targetParameter name="outputFilename" value="FeatureCatalogue" /><targetParameter name="inheritedProperties" value="true" /><targetParameter name="changeInfo" value="false" /><targetParameter name="outputFormat" value="DOCX" /><targetParameter name="name" value="«applicationSchema» ISO 19135-1 Procedures for Registration - Extended schema" /><targetParameter name="scope" value="" /><targetParameter name="versionNumber" value="1.0" /><targetParameter name="versionDate" value="31.10.2014" /><targetParameter name="producer" value="Statens kartverk, http://www.statkart.no/" /><targetParameter name="xsltPfad" value="C:\Data\isotc211\Redlands\UMLdocumentation\WorkshopRedlands\ShapeChange\FC" /><targetParameter name="xsltPath" value="C:\Data\isotc211\Redlands\UMLdocumentation\WorkshopRedlands\ShapeChange\FC" /><targetParameter name="xslhtmlFile" value="html2.xsl" /><targetParameter name="xslframeHtmlFileName" value="frameHtml.xsl" /><targetParameter name="xsldocxFile" value="docx.xsl" /><targetParameter name="docxTemplateDirectory" value="C:\Program Files\Arkitektum AS\ShapeChange\templates" /><targetParameter name="docxTemplateFilename" value="mal.docx" /><targetParameter name="notesRuleMarker" value="-==-" /><targetParameter name="featureTerm" value="Objekttype" /><targetParameter name="includeDiagrams" value="true" /></Target></targets></ShapeChangeConfiguration>